{
  "page_title": "Miami, FL to Orlando, FL LTL Freight | WARP",
  "meta_description": "LTL freight from Miami to Orlando: 243-mile lane, 1-2 day transit. Get instant rates, carrier visibility, and book through WARP.",
  "lane_slug": "miami-to-orlando",
  "canonical_path": "/lanes/miami-to-orlando",
  "mode": "LTL",
  "segment": "smb",
  "origin": "Miami, FL",
  "destination": "Orlando, FL",
  "lane_stats": {
    "estimated_distance_miles": 243,
    "estimated_transit_days_range": {
      "min": 1,
      "max": 2
    },
    "estimated_rate_range_usd": {
      "low": 615,
      "high": 820
    },
    "common_freight_class_range": null,
    "common_equipment": [
      "Dry Van",
      "Reefer (temp-controlled)"
    ],
    "seasonality_notes": "Hurricane risk Jun-Nov. Consistent retail demand year-round.",
    "confidence": {
      "transit": "modeled",
      "rate": "modeled"
    },
    "disclaimers": [
      "These are modeled estimates, not guaranteed quotes.",
      "Actual rates depend on freight details, accessorials, and current market conditions."
    ]
  },
  "network_proof": {
    "estimated_carrier_count": 9,
    "nearest_cross_docks": [
      "Miami Gateway",
      "Atlanta Hub",
      "Charlotte Terminal"
    ],
    "service_notes": [
      "Real-time scan events at pickup, in-transit, and delivery",
      "Estimated 1-2 business day transit window",
      "Pallet-level tracking with delivery appointment scheduling",
      "Exception alerts within 30 minutes of status change"
    ],
    "origin_region": "Southeast",
    "destination_region": "Southeast"
  },
  "hero": {
    "headline": "Miami, FL to Orlando, FL LTL Freight",
    "subhead": "243 miles. 1-2 business day transit. 9 carriers active on this lane.",
    "primary_cta": {
      "label": "Get Instant Quote",
      "url": "https://www.wearewarp.com/quote"
    },
    "secondary_cta": {
      "label": "Book a Fit Call",
      "url": "https://www.wearewarp.com/book"
    }
  },
  "lane_overview": {
    "heading": "Lane Overview",
    "body": "The Miami to Orlando LTL lane covers approximately 243 miles between the Southeast and Southeast regions. Standard transit runs 1-2 business days depending on carrier routing and terminal schedules. Common equipment on this corridor includes Dry Van, Reefer (temp-controlled). Cross-dock facilities at Miami Gateway, Atlanta Hub, Charlotte Terminal support consolidation and transit optimization. Hurricane risk Jun-Nov. Consistent retail demand year-round."
  },
  "warp_fit_for_lane": {
    "heading": "How WARP Operates the Miami to Orlando Lane",
    "body": "WARP covers the Miami to Orlando corridor with 9 vetted carriers providing LTL capacity. Service capabilities on this lane include: Real-time scan events at pickup, in-transit, and delivery; Estimated 1-2 business day transit window; Pallet-level tracking with delivery appointment scheduling. Shipments receive pallet-level tracking from pickup through delivery with appointment scheduling and delivery confirmation. Nearby cross-dock operations at Miami Gateway and Atlanta Hub enable consolidation and re-routing when exceptions occur. Exception alerts fire within 30 minutes of any status change. WARP's operations team manages carrier coordination, rescheduling, and resolution without requiring shipper follow-up."
  },
  "operating_details": {
    "heading": "Operating Details",
    "items": [
      "Estimated lane distance: 243 miles (Miami to Orlando)",
      "Transit window: 1-2 business days for standard LTL service",
      "Available equipment: Dry Van, Reefer (temp-controlled)",
      "Active carriers on this lane: 9",
      "Nearest cross-dock facilities: Miami Gateway, Atlanta Hub, Charlotte Terminal",
      "Real-time scan events at pickup, in-transit, and delivery milestones",
      "Exception alerts within 30 minutes of status changes with automated escalation",
      "Delivery appointment scheduling and confirmation managed by WARP operations"
    ]
  },
  "pricing_and_commercial_framing": {
    "heading": "Pricing & Rate Factors",
    "body": "Estimated LTL rates on the Miami to Orlando lane range from $615 to $820, depending on freight class, weight, pallet count, and seasonal demand. Key cost drivers include NMFC freight classification, shipment density, and whether accessorials such as liftgate, inside delivery, or limited-access pickup apply. At 243 miles, the linehaul distance is the largest cost component (approximately $2.95/mile). Fuel surcharges are applied as a separate line item based on current diesel prices. These are modeled estimates. Enter your shipment details to get a real-time, all-in rate."
  },
  "lane_specific_faqs": [
    {
      "question": "How much does LTL freight from Miami, FL to Orlando, FL cost?",
      "answer": "Estimated LTL rates range from $615 to $820 based on freight class, weight, and pallet count. Actual rates depend on shipment specifics and current market conditions. Get an instant quote for real-time pricing."
    },
    {
      "question": "What is the transit time for LTL shipments from Miami to Orlando?",
      "answer": "Standard LTL transit on this 243-mile lane is 1-2 business days. Actual transit depends on carrier routing, terminal schedules, and pickup timing."
    },
    {
      "question": "What carriers does WARP use on the Miami to Orlando lane?",
      "answer": "WARP maintains a vetted network of approximately 9 active carriers on this corridor. Carrier selection is optimized for each shipment based on equipment requirements, transit targets, and performance history."
    },
    {
      "question": "Can I track my LTL shipment from Miami to Orlando in real time?",
      "answer": "Yes. Every shipment includes real-time tracking with scan events at pickup, in-transit checkpoints, and delivery. Exception alerts fire within 30 minutes of any status change, and WARP's operations team manages resolution directly."
    },
    {
      "question": "What equipment is available for LTL freight on this lane?",
      "answer": "Common equipment on the Miami to Orlando corridor includes Dry Van, Reefer (temp-controlled). Equipment availability varies by season and demand. Specify your requirements when requesting a quote."
    }
  ],
  "related_links": {
    "corridor_hub": "/corridors/southeast-to-southeast",
    "related_lanes": [
      {
        "label": "Miami to Atlanta",
        "path": "/lanes/miami-to-atlanta"
      },
      {
        "label": "Dallas to Chicago",
        "path": "/lanes/dallas-to-chicago"
      },
      {
        "label": "Chicago to Dallas",
        "path": "/lanes/chicago-to-dallas"
      },
      {
        "label": "Los Angeles to Phoenix",
        "path": "/lanes/los-angeles-to-phoenix"
      },
      {
        "label": "Atlanta to Orlando",
        "path": "/lanes/atlanta-to-orlando"
      },
      {
        "label": "Houston to Dallas",
        "path": "/lanes/houston-to-dallas"
      },
      {
        "label": "Chicago to Atlanta",
        "path": "/lanes/chicago-to-atlanta"
      },
      {
        "label": "Phoenix to Los Angeles",
        "path": "/lanes/phoenix-to-los-angeles"
      }
    ],
    "tool_link": "https://www.wearewarp.com/quote",
    "data_link": null
  },
  "lane_relevant_cta": {
    "headline": "Ship LTL Freight: Miami to Orlando",
    "body": "Enter your shipment details to get a real-time LTL rate for the Miami to Orlando lane. No commitment required.",
    "primary_cta": {
      "label": "Get Your Quote",
      "url": "https://www.wearewarp.com/quote"
    }
  }
}